<xs:schema xmlns:xs="http://www.w3.org/2001/XMLSchema">
    <xs:element name="Departamentos">
        <xs:complexType>
            <xs:sequence>
                <xs:element name="Departamento">
                    <xs:complexType>
                        <xs:sequence>
                            <xs:element name="Nombre" type="xs:string"/>
                        </xs:sequence>
                    </xs:complexType>
                </xs:element>
            </xs:sequence>
        </xs:complexType>
    </xs:element>
</xs:schema>