<?xml version="1.0" encoding="UTF-8" standalone="no"?>
<Departamentos xmlns:xs="http://www.w3.org/2001/XMLSchema"
xs:noNamespaceSchemaLocation="departamentos_jph.xsd">
    <Departamento>
        <Nombre>COMERCIAL</Nombre>
    </Departamento>
    <Departamento>
        <Nombre>CONTABILIDAD</Nombre>
    </Departamento>
    <Departamento>
        <Nombre>INFORM√ÅTICA</Nombre>
    </Departamento>
    <Departamento>
        <Nombre>PERSONAL</Nombre>
    </Departamento>
</Departamentos>